CourseID,Code,DepartmentID,Name,Credit,description,StudentStandingPrerequisite,StudentStandingRecommendation
88,478,1,Computational Neuroscience,"[3,4)","Computer simulations and mathematical analysis of neurons and neural circuits, and the computational properties of nervous systems.  Students are taught a range of models for neurons and neural circuits, and are asked to implement and explore the computational and dynamic properties of these models.  The course introduces students to dynamical systems theory for the analysis of neurons and neural learning, models of brain systems, and their relationship to artificial and neural networks.  Term project required.  Students enrolled in MATH478 will make arrangements with the instructor to attend additional lectures and complete additional assignments addressing mathematical topics related to the course.",null,null
89,325,1,Computer Networks I,"[3,4)","An introduction to computer networks and the Internet.  Applications: http, ftp, e-mail, DNS, socket programming.  Transport: UDP, TCP, reliable data transfer, and congestion control.  Network layer: IP, routing, and NAT.  Link layer: taxonomy, Ethernet, 802.11.",null,null
90,275,1,Fundamentals of Robotics,"[4,5)","The Fundamentals of Robotics course will expose students to fundamental principles of robotics.  Students will explore high level conceptual foundations of robotics beginning with Braitenberg vehicles and apply this knowledge to simulated and physical robot hardware in laboratory experiences and in a final project.  Laboratory experiences will guide students through applying theory to practice increasingly complex tasks in a project oriented, group work environment.  The course culminates in a robotics challenge project at the end of the semester.  Topics covered are: sensors, actuators, kinematics, control, planning and programming.  Programming languages and concepts (e.g., C++, object oriented programming) used in robotics will be introduced and used with modern robotics programming toolboxes and frameworks.  Prior experience with these languages will not be necessary.  Previous experience with robotics is not required for this course.",null,null
91,386,1,"Quantum Computing, Information, and Devices","[3,4)","An introduction to the math, physics, engineering, and computer science underlying the rapidly emerging fields of quantum computing, quantum information, and quantum devices. The course is taught by a group of faculty from physics, engineering, computer science, and math, and is geared towards students with diverse backgrounds and interests in these fields.  Students will select a concentration in one of these four areas, and the coursework, while still covering all topics, will be adjusted to focus on the selected area in the most detail.  Note that the listed prerequisites depend on choice of concentration. 

Topics will include:
1.	(Mathematics) Introduction to linear algebra, convex geometry, fundamental theory of quantum information.
2.	(Physics) Introduction to the quantum mechanics of two-level systems (qubits). Survey of physics and materials for qubit technologies.
3.	(Computer Science) Basic quantum gates and circuits, introduction to the theory of algorithms, survey of quantum algorithms.
4.	(Engineering) Quantum architectures, mapping algorithms onto circuits.

The course consists of lectures, homework, and group projects.  Group projects will aim to synthesize the diverse backgrounds of the students and instructors to capture the interdisciplinary nature of the field. Students taking the course for graduate credit will complete an additional literature research project and presentation, in addition to enhanced problem sets.",null,null
92,601,1,Independent Study,"[1, 19)",null,null,null
93,133,1,Introduction to Data Science and Engineering for Majors,"[3,4)","This course is an introduction to data science and analytics.

In the first half of the course, students will develop a basic understanding of how to manipulate, analyze and visualize large data in a distributed computing environment, with an appreciation of open source development, security and privacy issues.

Case studies and team project assignments in the second half of the course will be used to implement the ideas. Topics covered will include: Overview of large scale parallel and distributed (cloud) computing; file systems and file i/o; open source coding and distributed versioning, data query and retrieval; basic data analysis; visualization; data security, privacy and provenance.",null,null
94,341,1,Introduction to Database Systems,"[3,4)","Relational model, ER model, relational algebra and calculus, SQL, OBE, security, views, files and physical database structures, query processing and query optimization, normalization theory, concurrency control, object relational systems, multimedia databases, Oracle SQL server, Microsoft SQL server.",null,null
95,489,1,Robotics I,"[3,4)","Orientation and configuration coordinate transformations, forward and inverse kinematics and Newton-Euler and Lagrange-Euler dynamic analysis. Planning of manipulator trajectories. Force, position, and hybrid control of robot manipulators. Analytical techniques applied to select industrial robots.",null,null
96,438,1,High Performance Computing,"[3,4)","High performance computing (HPC) leverages parallel processing in order to maximize speed and throughput. This hands-on course will cover theoretical and practical aspects of HPC. Theoretical concepts covered include computer architecture, parallel programming, and performance optimization. Practical applications will be discussed from various information and scientific fields. Practical considerations will include HPC job management and Unix scripting. Weekly assessments and a course project will be required.",null,null
97,293,1,Software Craftsmanship,"[4,5)","A course to improve programming skills, software quality, and the software development process.  Software design; Version control; Control issues and routines;  Pseudo-code programming process and developer testing; Defensive programming; Classes; Debugging; Self-documenting code; Refactoring.",null,null
98,201,2,Introduction to Linear Algebra for Applications,"[3,4)","Matrix operations, systems of linear equations, vector spaces, subspaces, bases and linear independence, eigenvalues and eigenvectors, diagonalization of matrices, linear transformations, determinants. Less theoretical than MATH 307.",null,null
99,307,2,Linear Algebra,"[3,4)","A course in linear algebra that studies the fundamentals of vector spaces, inner product spaces, and linear transformations on an axiomatic basis. Topics include: solutions of linear systems, matrix algebra over the real and complex numbers, linear independence, bases and dimension, eigenvalues and eigenvectors, singular value decomposition, and determinants. Other topics may include least squares, general inner product and normed spaces, orthogonal projections, finite dimensional spectral theorem. This course is required of all students majoring in mathematics and applied mathematics. More theoretical than MATH 201.",null,null
100,223,2,Calculus for Science and Engineering III,"[3,4)","Introduction to vector algebra; lines and planes. Functions of several variables: partial derivatives, gradients, chain rule, directional derivative, maxima/minima. Multiple integrals, cylindrical and spherical coordinates. Derivatives of vector valued functions, velocity and acceleration. Vector fields, line integrals, Green's theorem. Credit for at most one of MATH 223 and MATH 227 can be applied to hours required for graduation",null,null
101,227,2,Calculus III,"[3,4)",Vector algebra and geometry. Linear maps and matrices. Calculus of vector valued functions. Derivatives of functions of several variables. Multiple integrals. Vector fields and line integrals. Credit for at most one of MATH 223 and MATH 227 can be applied to hours required for graduation,null,null
102,122,3,General Physics II - Electricity and Magnetism,"[4,5)","Electricity and magnetism, emphasizing the basic electromagnetic laws of Gauss, Ampere, and Faraday. Maxwell's equations and electromagnetic waves, interference, and diffraction. This course has a laboratory component. Students may earn credit for only one of the following courses: PHYS 116, PHYS 122, PHYS 124. Prereq: PHYS 121 or PHYS 123.",null,null
103,124,3,Physics and Frontiers II - Electricity and Magnetism,"[4,5)","Time-independent and time-dependent electric and magnetic fields. The laws of Coulomb, Gauss, Ampere, and Faraday. Microscopic approach to dielectric and magnetic materials. Introduction to the usage of vector calculus; Maxwell's equations in integral and differential form. The role of special relativity in electromagnetism. Electromagnetic radiation. This course has a laboratory component. Students may earn credit for only one of the following courses: PHYS 116, PHYS 122, PHYS 124.",null,null
104,380,2,Introduction to Probability,"[3,4)","Combinatorial analysis. Permutations and combinations. Axioms of probability. Sample space and events. Equally likely outcomes. Conditional probability. Bayes' formula. Independent events and trials. Discrete random variables, probability mass functions. Expected value, variance. Bernoulli, binomial, Poisson, geometric, negative binomial random variables. Continuous random variables, density functions. Expected value and variance. Uniform, normal, exponential, Gamma random variables. The De Moivre-Laplace limit theorem. Joint probability mass functions and densities. Independent random variables and the distribution of their sums. Covariance. Conditional expectations and distributions (discrete case). Moment generating functions. Law of large numbers. Central limit theorem. Additional topics (time permitting): the Poisson process, finite state space Markov chains, entropy.",null,null
105,122,2,Calculus for Science and Engineering II,"[4,5)","Continuation of MATH 121. Exponentials and logarithms, growth and decay, inverse trigonometric functions, related rates, basic techniques of integration, area and volume, polar coordinates, parametric equations. Taylor polynomials and Taylor's theorem. Credit for at most one of MATH 122, MATH 124, and MATH 126 can be applied to hours required for graduation",null,null
106,121,3,General Physics I - Mechanics,"[4,5)","Particle dynamics, Newton's laws of motion, energy and momentum conservation, rotational motion, and angular momentum conservation. This course has a laboratory component. Recommended preparation: MATH 121 or MATH 123 or MATH 125 or one year of high school calculus. Students who do not have the appropriate background should not enroll in PHYS 121 without first consulting the instructor. Students may earn credit for only one of the following courses: PHYS 115, PHYS 121, PHYS 123.",null,null
107,121,2,Calculus for Science and Engineering I,"[4,5)","Functions, analytic geometry of lines and polynomials, limits, derivatives of algebraic and trigonometric functions. Definite integral, antiderivatives, fundamental theorem of calculus, change of variables. Recommended preparation: Three and one half years of high school mathematics. Credit for at most one of MATH 121, MATH 123 and MATH 125 can be applied to hours required for graduation. Counts for CAS Quantitative Reasoning Requirement",null,null
108,345,4,Theoretical Statistics I,"[3,4)","Topics provide the background for statistical inference. Random variables; distribution and density functions; transformations, expectation. Common univariate distributions. Multiple random variables; joint, marginal and conditional distributions; hierarchical models, covariance. Distributions of sample quantities, distributions of sums of random variables, distributions of order statistics. Methods of statistical inference. Offered as STAT 345, STAT 445, and PQHS 481",null,null