CourseID,Code,DepartmentID,Name,Credit,description,StudentStandingPrerequisite,StudentStandingRecommendation
49,314,1,Computer Architecture,"[3,4)","This course provides students the opportunity to study and evaluate a modern computer architecture design.  The course covers topics in fundamentals of computer design, performance, cost, instruction set design, processor implementation, control unit, pipelining, communication and network, memory hierarchy, computer arithmetic, input-output, and an introduction to RISC and super-scalar processors.",null,null
50,493,1,Software Engineering,"[3,4)",Topics: Introduction to software engineering; software lifecycle models; development team organization and project management; requirements analysis and specification techniques; software design techniques; programming practices; software validation techniques; software maintenance practices; software engineering ethics. Undergraduates work in teams to complete a significant software development project. Graduate students are required to complete a research project.,null,null
51,435,1,Data Mining,"[3,4)","Data Mining is the process of discovering interesting knowledge from large amounts of data stored either in databases, data warehouses, or other information repositories. Topics to be covered includes: Data Warehouse and OLAP technology for data mining, Data Preprocessing, Data Mining Primitives, Languages, and System Architectures, Mining Association Rules from Large Databases, Classification and Prediction, Cluster Analysis, Mining Complex Types of Data, and Applications and Trends in Data Mining.",null,null
52,236,1,Introduction to C/C++ Programming,"[1,2)","This course provides an introduction to C and C++ programming languages. Prior knowledge of these languages is not expected. However, students are expected to know at least one programming language prior to the class. The lectures will cover low-level programming techniques and object-oriented class design. Students will learn specific topics in C/C++ including required background knowledge, pointers & references, memory management, inheritance, polymorphism, templates, exceptions, use of debugging and compiler tools, and others as time permits.",null,null
53,456,1,Data Privacy,"[3,4)","Introduction to privacy, economics and incentives, crypto-based solution for privacy, hiding data from the database user, hiding access patterns from the database owner, anonymous routing and TOR, privacy in online social networks, privacy in cellular and Wi-Fi networks, location privacy, privacy in e-cash systems, privacy in e-voting, genomic privacy.",null,null
54,315,1,Scalable Parallel Data Analysis,"[3,4)","This course provides an introduction to scalable and parallel data analysis using the most common frameworks and programming tools in the age of big data. Covered topics include parallel programming models, parallel hardware architectures, multi-threaded, multi-core programming, cluster computing and GPU programming. The course is designed to provide a heavily hands-on experience with several programming assignments.",null,null
56,440,1,Machine Learning,"[3,4)","Machine learning is a subfield of Artificial Intelligence that is concerned with the design and analysis of algorithms that ""learn"" and improve with experience,  While the broad aim behind research in this area is to build systems that can simulate or even improve on certain aspects of human intelligence, algorithms developed in this area have become very useful in analyzing and predicting the behavior of complex systems.  Machine learning algorithms have been used to guide diagnostic systems in medicine, recommend interesting products to customers in e-commerce, play games at human championship levels, and solve many other very complex problems.  This course is focused on algorithms for machine learning: their design, analysis and implementation.  We will study different learning settings, including supervised, semi-supervised and unsupervised learning.  We will study different ways of representing the learning problem, using propositional, multiple-instance and relational representations.  We will study the different algorithms that have been developed for these settings, such as decision trees, neural networks, support vector machines, k-means, harmonic functions and Bayesian methods.  We will learn about the theoretical tradeoffs in the design of these algorithms, and how to evaluate their behavior in practice.  At the end of the course, you should be able to:
   --Recognize situations where machine learning algorithms are applicable;
   --Understand, represent and formulate the learning problem;
   --Apply the appropriate algorithm(s), or if necessary, design your own, with an understanding of the tradeoffs involved;
   --Correctly evaluate the behavior of the algorithm when solving the problem.",null,null
57,589,1,Robotics II,"[3,4)","Survey of research issues in robotics. Force control, visual servoing, robot autonomy, on-line planning, high-speed control, man/machine interfaces, robot learning, sensory processing for real-time control. Primarily a project-based lab course in which students design real-time software executing on multi-processors to control an industrial robot.",null,null
58,234,1,Structured and Unstructured Data,"[3,4)","This course is an introduction to types of data and their representation, storage, processing and analysis. The course has three parts.  In the first part of the course, students will develop a basic understanding and the ability to represent, store, process and analyze structured data. Structured data include catalogs, records, tables, logs, etc., with a fixed dimension and well-defined meaning for each data point. Suitable representation and storage mechanisms include lists and arrays. Relevant techniques include keys, hashes, stacks, queues and trees. In the second part of the course, students will develop a basic understanding and the ability to represent, store, process and analyze semi-structured data. Semi-structured data include texts, web pages and networks, without a dimension and structure, but with well-defined meaning for each data point. Suitable representation and storage mechanisms include trees, graphs and RDF triples. Relevant techniques include XML, YAML, JSON, parsing, annotation, language processing. In the third part of the course, students will develop a basic understanding and the ability to represent, store, process and analyze unstructured data. Unstructured data include images, video, and time series data, without neither a fixed dimension and structure, nor well-defined meaning for individual data points. Suitable representation and storage mechanisms include large matrices, EDF, DICOM. Relevant techniques include feature extraction, segmentation, clustering, rendering, indexing, and visualization.",null,null
59,335,1,Data Mining for Big Data,"[3,4)","With the unprecedented rate at which data is being collected today in almost all fields of human endeavor, there is an emerging economic and scientific need to extract useful information from it. Data mining is the process of automatic discovery of patterns, changes, associations and anomalies in massive databases, and is a highly interdisciplinary field representing the confluence of several disciplines, including database systems, data warehousing, machine learning, statistics, algorithms, data visualization, and high-performance computing. This course is an introduction to the commonly used data mining techniques.
In the first part of the course, students will develop a basic understanding of the basic concepts in data mining such as frequent pattern mining, association rule mining, basic techniques for data preprocessing such as normalization, regression, and classic matrix decomposition methods such as SVD, LU, and QR decompositions. In the second part of the course, students will develop a basic understanding of classification and clustering and be able to apply classic methods such as k-means, hierarchical clustering methods, nearest neighbor methods, association based classifiers. In the third part of the course, students will have a chance to study more advanced data mining applications such as feature selection in high-dimensional data, dimension reduction, and mining biological datasets.",null,null
60,496,1,Artificial Intelligence: Sequential Decision Making,"[3,4)","This course will study the formulation and solution of decision making problems by automated agents. Topics covered include one-shot decision making (decision trees and influence diagrams),  Markov decision processes (MDPs) , automated classical and probabilistic planning, reinforcement learning (RL), hierarchical planning and RL, partially observable MDPs, Bayesian RL, collaborative multi-agent systems.",null,null
61,448,1,Smartphone Security,"[3,4)","This course is designed to better prepare undergraduate and graduate students for researching and developing in the neighborhood of mobile and software security. Lectures, paper readings and presentations, in-class discussions, and projects are the main components. The course covers the basics of Android programming and a wide range of security issues and solutions concerning mobile platforms, including permission analysis, textual artifacts analysis, malware analysis, program analysis, and UI analysis. Students should expect one literature survey paper and one system-building or empirical study project on one selected security solution in mobile app security.",null,null
62,341,1,Introduction to Databases: DS Major,"[3,4)","Database management become a central component of a modern computing environment, and, as a result, knowledge about database systems has become an essential part of education in computer science and data science. This course is an introduction to the nature and purpose of database systems, fundamental concepts for designing, implementing and querying a database and database architectures. 
Weeks 1-6 provide an overview of basic database systems concepts including database design, database systems architecture, and database querying, using relational model and SQL as query language. 
Weeks 7-10 Objects, Semi structured data, XML and RDF basics.
Weeks 11-14 provide an overview of more advanced topics including Database System Architectures (Parallel Databases and Distributed Databases), and Data Warehousing and Information Retrieval.
Students cannot receive credit for both CSDS341 and CSDS341D.",'graduate',null
63,281,1,Logic Design and Computer Organization,"[4,5)",Fundamentals of digital systems in terms of both computer organization and logic level design.  Organization of digital computers; information representation; boolean algebra; analysis and synthesis of combinational and sequential circuits; datapaths and register transfers; instruction sets and assembly language; input/output and communication; memory.,null,null
64,290,1,Introduction to Computer Game Design and Implementation,"[3,4)","This class begins with an examination of the history of video games and of game design. Games will be examined in a systems context to understand gaming and game design fundamentals. Various topics relating directly to the implementation of computer games will be introduced including graphics, animation, artificial intelligence, user interfaces, the simulation of motion, sound generation, and networking. Extensive study of past and current computer games will be used to illustrate course concepts. Individual and group projects will be used throughout the semester to motivate, illustrate and demonstrate the course concepts and ideas. Group game development and implementation projects will culminate in classroom presentation and evaluation.",null,null
65,494,1,Introduction to Information Theory,"[3,4)","This course is intended as an introduction to information and coding theory with emphasis on the mathematical aspects.  It is suitable for advanced undergraduate and graduate students in mathematics, applied mathematics, statistics, physics, computer science and electrical engineering.  

Course content: Information measures-entropy, relative entropy, mutual information, and their properties.  Typical sets and sequences, asymptotic equipartition property, data compression.  Channel coding and capacity: channel coding theorem.  Differential entropy, Gaussian channel, Shannon-Nyquist theorem. Information theory inequalities (400 level). Additional topics, which may include compressed sensing and elements of quantum information theory.",null,null
66,132,1,Introduction to Programming in Java,"[3,4)","An introduction to modern programming language features, computer programming and algorithmic problem solving with an emphasis on the Java language. Computers and code compilation; conditional statements, subprograms, loops, methods; object-oriented design, inheritance and polymorphism, abstract classes and interfaces; types, type systems, generic types, abstract data types, strings, arrays, linked lists; software development, modular code design, unit testing; strings, text and file I/O; GUI components, GUI event handling; threads; comparison of Java to C, C++, and C#.",null,null
67,427,1,Internet Security and Privacy,"[3,4)","This course introduces students to research on Internet security and privacy. Covered topics include denial of service attacks, attacks enabled by man-in-the-middle surveillance, communication hijacking, botnet and fast-flux networks, email and Web spam, threats to privacy on the Internet, and Internet censorship. The course will be based on a collection of research papers. Students will be required to attend lectures, read the materials, prepare written summaries of discussed papers, present a paper in class, complete a course project and take the final exam (in the form of the course project presentation).",null,null
68,400,1,Graduate Teaching I,"[0,1)","This course will provide the Ph.D. candidate with experience in teaching undergraduate or graduate students.  The experience is expected to involve direct student contact but will be based upon the specific departmental needs and teaching obligations.  This teaching experience will be conducted under the supervision of the faculty member who is responsible for the course, but the academic advisor will assess the educational plan to ensure that it provides an educational experience for the student.  Students in this course may be expected to perform one or more of the following teaching related activities: grading homeworks, quizzes, and exams, having office hours for students, tutoring students.",null,'Ph.D.'
69,433,1,Database Systems,"[3,4)","Basic issues in file processing and database management systems. Physical data organization. Relational databases. Database design. Relational Query Languages, SQL. Query languages. Query optimization. Database integrity and security. Object-oriented databases. Object-oriented Query Languages, OQL.",null,null
70,695,1,Project M.S.,"[1, 10)",Research course taken by Plan B M.S. students.,null,null
71,465,1,Computer Vision,"[3,4)","The goal of computer vision is to create visual systems that recognize objects and recover structures in complex 3D scenes.  This course emphasizes both the science behind our understanding of the fundamental problems in vision and the engineering that develops mathematical models and inference algorithms to solve these problems.  Specific topics include feature detection, matching, and classification; visual representations and dimensionality reduction; motion detection and optical flow; image segmentation; depth perception, multi-view geometry, and 3D reconstruction; shape and surface perception; visual scene analysis and object recognition.",null,null
72,310,1,Algorithms,"[3,4)","Fundamentals in algorithm design and analysis. Loop invariants, asymptotic notation, recurrence relations, sorting algorithms, divide-and-conquer, dynamic programming, greedy algorithms, basic graph algorithms.",null,null
73,500,1,CSDS Colloquium,"[0,1)",Seminars on current topics in Computer and Data Science,null,null
74,444,1,Computer Security,"[3,4)","General types of security attacks; approaches to prevention; secret key and public key cryptography; message authentication and hash functions; digital signatures and authentication protocols; information gathering; password cracking; spoofing; session hijacking; denial of service attacks; buffer overruns; viruses, worms, etc., principles of secure software design, threat modeling; access control; least privilege; storing secrets; socket security; firewalls; intrusions; auditing; mobile security.",null,null
75,477,1,Advanced Algorithms,"[3,4)","Design and analysis of efficient algorithms, with emphasis on network flow, combinatorial optimization, and randomized algorithms. Linear programming: duality, complementary slackness, total unimodularity. Minimum cost flow: optimality conditions, algorithms, applications. Game theory: two-person zero-sum games, minimax theorems. Probabilistic analysis and randomized algorithms: examples and lower bounds. Approximation algorithms for NP-hard problems: examples, randomized rounding of linear programs.",null,null
76,442,1,Causal Learning from Data,"[3,4)","This course introduces key concepts and techniques for characterizing, from observational or experimental study data and from background information, the causal effect of a specific treatment, exposure, or intervention (e.g., a medical treatment) upon an outcome of interest (e.g., disease status). The fundamental problem of causal inference is the impossibility of observing the effects of different and incompatible treatments on the same individual or unit.  This problem is overcome by estimating an average causal effect over a study population.  Making valid causal inferences with observational data is especially challenging, because of the greater potential for biases (confounding bias, selection bias, and measurement bias) that can badly distort causal effect estimates.  Consequently, this topic has been the focus of intense cross-disciplinary research in recent years.  Causal inference techniques will be illustrated by applications in several fields such as computer science, engineering, medicine, public health, biology, genomics, neuroscience, economics, and social science.  Course grading will be based on quizzes, homeworks, a class presentation, and a causal data analysis project.

Specific topics: treatments, exposures, and interventions; causal effects and causal effect measures; confounding bias; potential outcomes and counterfactuals; randomized experiments; observational studies; causal directed acyclic graphs (DAGs); exchangeability and conditional exchangeability; effect modification; causal interactions; nonparametric structural equations; Pearl's Back-Door Criterion, Front-Door Criterion, and related results; covariate adjustment; matching on covariates; selection bias; measurement bias; instrumental variables; causal modeling; inverse probability weighting; marginal structural models; standardization; structural nested models; outcome regression; propensity scores; sensitivity analysis.",null,null
77,345,1,Programming Language Concepts,"[3,4)","This course examines the four main programming paradigms: imperative, object-oriented, functional, and logical. It is assumed that students will come to the course with significant exposure to object-oriented programming and some exposure to imperative programming.  The course will teach the functional paradigm in depth, enhance the students' knowledge of the object-oriented and imperative paradigms, and introduce the logical paradigm. The course will explore language syntax, semantics, names/scopes, types, expressions, assignment, subprograms, abstraction and inheritance.  This exploration will have several forms. Students will study the programming language concepts at a theoretical level, use the concepts in functional language programming, and implement the concepts by designing language interpreters.",null,null
78,325,1,Computer Networks I,"[3,4)","An introduction to computer networks and the Internet.  Applications: http, ftp, e-mail, DNS, socket programming.  Transport: UDP, TCP, reliable data transfer, and congestion control.  Network layer: IP, routing, and NAT.  Link layer: taxonomy, Ethernet, 802.11.",null,null
79,701,1,Dissertation Ph.D.,"[1, 10)",Credit as arranged,null,null
80,491,1,Artificial Intelligence: Probabilistic Graphical Models,"[3,4)","This course is a graduate-level introduction to Artificial Intelligence (AI), the discipline of designing intelligent systems, and focuses on probabilistic graphical models.  These models can be applied to a wide variety of settings from data analysis to machine learning to robotics.  The models allow intelligent systems to represent uncertainties in an environment or problem space in a compact way and reason intelligently in a way that makes optimal use of available information and time.  The course covers directed and undirected probabilistic graphical models, latent variable models, associated exact and approximate inference algorithms, and learning in both discrete and continuous problem spaces.  Practical applications are covered throughout the course.",null,null
81,394,1,Introduction to Information Theory,"[3,4)","This course is intended as an introduction to information and coding theory with emphasis on the mathematical aspects.  It is suitable for advanced undergraduate and graduate students in mathematics, applied mathematics, statistics, physics, computer science and electrical engineering.  

Course content: Information measures-entropy, relative entropy, mutual information, and their properties.  Typical sets and sequences, asymptotic equipartition property, data compression.  Channel coding and capacity: channel coding theorem.  Differential entropy, Gaussian channel, Shannon-Nyquist theorem. Information theory inequalities (400 level). Additional topics, which may include compressed sensing and elements of quantum information theory.",null,null
82,459,1,Bioinformatics for Systems Biology,"[3,4)","Description of omic data (biological sequences, gene expression, protein-protein interactions, protein-DNA interactions, protein expression, metabolomics, biological ontologies), regulatory network inference, topology of regulatory networks, computational inference of protein-protein interactions, protein interaction databases, topology of protein interaction networks, module and protein complex discovery, network alignment and mining, computational models for network evolution, network-based functional inference, metabolic pathway databases, topology of metabolic pathways, flux models for analysis of metabolic networks, network integration, inference of domain-domain interactions, signaling pathway inference from protein interaction networks, network models and algorithms for disease gene identification, identification of dysregulated subnetworks network-based disease classification.",null,null
83,393,1,Software Engineering,"[3,4)",Topics: Introduction to software engineering; software lifecycle models; development team organization and project management; requirements analysis and specification techniques; software design techniques; programming practices; software validation techniques; software maintenance practices; software engineering ethics. Undergraduates work in teams to complete a significant software development project. Graduate students are required to complete a research project.,null,null
84,466,1,Computer Graphics,"[3,4)","Theory and practice of computer graphics: object and environment representation including coordinate transformations image extraction including perspective, hidden surface, and shading algorithms; and interaction.  Covers a wide range of graphic display devices and systems with emphasis in interactive shaded graphics.",null,null
85,302,1,Discrete Mathematics,"[3,4)","A general introduction to basic mathematical terminology and the techniques of abstract mathematics in the context of discrete mathematics. Topics introduced are mathematical reasoning, Boolean connectives, deduction, mathematical induction, sets, functions and relations, algorithms, graphs, combinatorial reasoning.",null,null
86,391,1,Introduction to Artificial Intelligence,"[3,4)","This course is an introduction to artificial intelligence.  We will study the concepts that underlie intelligent systems.  Topics covered include problem solving with search, constraint satisfaction, adversarial games, knowledge representation and reasoning using propositional and first order logic, reasoning under uncertainty, introduction to machine learning, automated planning, reinforcement learning and natural language processing.   Recommended: basic knowledge of probability and statistics.",null,null
87,285,1,Linux Tools and Scripting,"[3,4)","A fast paced introduction to linux that brings the project-oriented student from little or no linux experience to be fully capable of using scripting languages as tools in a linux command-line environment. This includes systems administration and agile web services with server-side scripting and server-side management. This also involves data cleaning, scraping, wrangling, and processing user data with regular expressions. Current main languages include php, bash, awk, with some client-side javascript, and very brief looks at tcl/lua, powershell, and python. Tools include vim, make, grep/sed, and curl/wget.",null,null
