CourseID,Code,DepartmentID,Name,Credit,description,StudentStandingPrerequisite,StudentStandingRecommendation
1,473,1,Modern Robot Programming,"[3,4)","The goal of this course is to learn modern methods for building up robot capabilities using the Robot Operating System (ROS). Through a sequence of assignments, students learn how to write software to control both simulated and physical robots. Material includes: interfacing software to robot I/O; path and trajectory planning for robot arms; object identification and localization from 3-D sensing; manipulation planning; and development of graphical interfaces for supervisory robot control. Laboratory assignments are scheduled in small groups to explore implementations on specific robots.  Graduate students will also perform an independent project.",null,null
2,428,1,Computer Communications Networks II,"[3,4)","Introduction to topics and methodology in computer networks and middleware research. Traffic characterization, stochastic models, and self-similarity. Congestion control (Tahoe, Reno, Sack). Active Queue Management (RED, FQ) and explicit QoS. The Web: overview and components, HTTP, its interaction with TCP, caching. Overlay networks and CDN. Expected work includes a course-long project on network simulation, a final project, a paper presentation, midterm, and final test.",null,null
3,344,1,Computer Security,"[3,4)","General types of security attacks; approaches to prevention; secret key and public key cryptography; message authentication and hash functions; digital signatures and authentication protocols; information gathering; password cracking; spoofing; session hijacking; denial of service attacks; buffer overruns; viruses, worms, etc., principles of secure software design, threat modeling; access control; least privilege; storing secrets; socket security; firewalls; intrusions; auditing; mobile security.",null,null
4,500,1,Graduate Teaching II,"[0,1)","This course will provide the Ph.D. candidate with experience in teaching undergraduate or graduate students.  The experience is expected to involve direct student contact but will be based upon the specific departmental needs and teaching obligations.  This teaching experience will be conducted under the supervision of the faculty member who is responsible for the course, but the academic advisor will assess the educational plan to ensure that it provides an educational experience for the student.  Students in this course may be expected to perform one or more of the following teaching related activities: grading homeworks, quizzes, and exams, having office hours for students, running recitation sessions, providing laboratory assistance.",null,'Ph.D.'
5,340,1,Machine Learning for Big Data,"[3,4)","Machine learning is a sub-field of Artificial Intelligence that is concerned with the design and analysis of algorithms that ""learn"" and improve with experience, While the broad aim behind research in this area is to build systems that can simulate or even improve on certain aspects of human intelligence, algorithms developed in this area have become very useful in analyzing and predicting the behavior of complex systems. Machine learning algorithms have been used to guide diagnostic systems in medicine, recommend interesting products to customers in e-commerce, play games at human championship levels, and solve many other very complex problems. This course is an introduction to algorithms for machine learning and their implementation in the context of big data. We will study different learning settings, the different algorithms that have been developed for these settings, and learn about how to implement these algorithms and evaluate their behavior in practice. We will also discuss dealing with noise, missing values, scalability properties and talk about tools and libraries available for these methods.
At the end of the course, you should be able to:
--Understand when to use machine learning algorithms;
--Understand, represent and formulate the learning problem;
--Apply the appropriate algorithm(s) or tools, with an understanding of the tradeoffs involved including scalability and robustness;
--Correctly evaluate the behavior of the algorithm when solving the problem.",null,null
6,296,1,Independent Projects,"[1,4)",Independent projects in Computer and Data Science.,null,null
7,395,1,Senior Project in Computer Science,"[4,5)","Capstone course for computer science seniors.  Material from previous and concurrent courses used to solve computer programming problems and to develop software systems.  Professional engineering topics such as project management, engineering design, communications, and professional ethics.  Requirements include periodic reporting of progress, plus a final oral presentation and written report.  Scheduled formal project presentations during last week of classes. Counts as SAGES Senior Capstone.",'freshmen & sophomore',null
8,297,1,Special Topics,"[1,4)",Special topics in Computer and Data Science.,'senior',null
9,458,1,Introduction to Bioinformatics,"[3,4)","Fundamental algorithmic and statistical methods in computational molecular biology and bioinformatics will be discussed. Topics include introduction to molecular biology and genetics, DNA sequence analysis, polymorphisms and personal genomics, structural variation analysis, gene mapping and haplotyping algorithms, phylogenetic analysis, biological network analysis, and computational drug discovery. Much of the course will focus on the algorithmic techniques, including but not limited to, dynamic programming, hidden Markov models, string algorithms, graph theories and algorithms, and some representative data mining algorithms. Paper presentations and course projects are also required.",'freshmen & sophomore',null
10,487,1,Advanced Game Development Project,"[3,4)","This game development project course will bring together an inter-professional group of students in the fields of engineering, computer science, and art to focus on the design and development of a complete, fully functioning computer game as an interdisciplinary team. The student teams are given complete liberty to design their own fully functional games from their original concept to a playable game published in an online marketplace. Student teams will experience the entire game development cycle as they execute their projects. Responsibilities include creating a game idea, writing a story, developing the artwork, designing characters, implementing music and sound effects, programming and testing the game, and publishing the final project. Students enrolled in 487 will develop a healthcare or education virtual environment or video game in collaboration with a mentor who has expertise in the chosen area.",null,null
11,312,1,Introduction to Data Science Systems,"[3,4)","An introduction to the software and hardware architecture of data science systems, with an emphasis on Operating Systems and Computer Architecture that are relevant to Data Sciences systems. At the end of the course, the student should understand the principles and architecture of storage systems, file systems (especially, HDFS), memory hierarchy, and GPU. The student should have carried out projects in these areas, and should be able to critically compare various design decisions in terms of capability and performance.",null,null
12,393,1,Software Engineering,"[3,4)",Topics: Introduction to software engineering; software lifecycle models; development team organization and project management; requirements analysis and specification techniques; software design techniques; programming practices; software validation techniques; software maintenance practices; software engineering ethics. Undergraduates work in teams to complete a significant software development project. Graduate students are required to complete a research project.,null,null
13,313,1,Introduction to Data Analysis,"[3,4)","In this class we will give a broad overview of data analysis techniques, covering
techniques from data mining, machine learning and signal processing.  Students will also learn about probabilistic representations, how to conduct an empirical study and support empirical hypotheses through statistical tests, and visualize the results.
Course objectives:
-Expose students to different analysis approaches.
-Understand probabilistic representations and inference mechanisms.
-Understand how to create empirical hypotheses and how to test them.",null,null
14,620,1,Special Topics,"[1, 19)",null,null,null
15,364,1,Computational Perception,"[3,4)","An introduction to the information processing and computational algorithms that underlie perception. The course focuses on vision and audition but also covers other senses and various types of perceptual processing in biological systems. The motivating question is: What are the fundamental computational problems faced by perceptual systems in complex environments? The course draws from fields in engineering and the study of biological perception. Specific topics include signal detection and processing; sound localization; motion perception and estimation; sensory coding; perception of structure; active perception; perceptual invariance; attention; object, sound and speech recognition; visual and auditory scene analysis.",null,null
16,343,1,Theoretical Computer Science,"[3,4)","Introduction to different classes of automata and their correspondence to different classes of formal languages and grammars, computability, complexity and various proof techniques.",null,null
17,339,1,Web Data Mining,"[3,4)","Web crawling technology, web search and information extraction, unsupervised and semi-supervised learning techniques and their application to web data extraction, social network analysis, various pagerank algorithms, link analysis, web resource discovery, web, resource description framework (RDF), XML, Web Ontology Language (OWL).",null,null
18,397,1,Special Topics,"[1,7)",Special topics in Computer and Data Science.,null,null
19,455,1,Applied Graph Theory,"[3,4)","This course serves as an introduction to many of the important aspects of graph theory. Topics include connectivity, flows, matchings, planar graphs, and graph coloring with additional topics selected from extremal graphs, random graphs, bounded treewidth graphs, social networks and small world graphs. The class will explore the underlying mathematical theory with a specific focus on the development and analysis of graph algorithms.",null,null
20,464,1,Computational Perception,"[3,4)","An introduction to the information processing and computational algorithms that underlie perception. The course focuses on vision and audition but also covers other senses and various types of perceptual processing in biological systems. The motivating question is: What are the fundamental computational problems faced by perceptual systems in complex environments? The course draws from fields in engineering and the study of biological perception. Specific topics include signal detection and processing; sound localization; motion perception and estimation; sensory coding; perception of structure; active perception; perceptual invariance; attention; object, sound and speech recognition; visual and auditory scene analysis.",null,null
21,366,1,Computer Graphics,"[3,4)","Theory and practice of computer graphics: object and environment representation including coordinate transformations image extraction including perspective, hidden surface, and shading algorithms; and interaction.  Covers a wide range of graphic display devices and systems with emphasis in interactive shaded graphics.",null,null
22,338,1,Intro to Operating Systems and Concurrent Programming,"[4,5)","Intro to OS: OS Structures, processes, threads, CPU scheduling, deadlocks, memory management, file system implementations, virtual machines, cloud computing. Concurrent programming: fork, join, concurrent statement, critical section problem, safety and liveness properties of concurrent programs, process synchronization algorithms, semaphores, monitors.  UNIX systems programming: system calls, UNIX System V IPCs, threads, RPCs, shell programming.",'junior & senior',null
23,376,1,Mobile Robotics,"[4,5)","Design of software systems for mobile robot control, including: motion control; sensory processing; localization and mapping; mobile-robot planning and navigation; and implementation of goal-directed behaviors.  The course has a heavy lab component involving a sequence of design challenges and competitions performed in teams.",null,null
24,337,1,Compiler Design,"[4,5)",Design and implementation of compilers and other language processors. Scanners and lexical analysis; regular expressions and finite automata; scanner generators; parsers and syntax analysis; context free grammars; parser generators; semantic analysis; intermediate code generation; runtime environments; code generation; machine independent optimizations; data flow and dependence analysis. There will be a significant programming project involving the use of compiler tools and software development tools and techniques.,null,null
25,345,1,Programming Language Concepts,"[3,4)","This course examines the four main programming paradigms: imperative, object-oriented, functional, and logical. It is assumed that students will come to the course with significant exposure to object-oriented programming and some exposure to imperative programming.  The course will teach the functional paradigm in depth, enhance the students' knowledge of the object-oriented and imperative paradigms, and introduce the logical paradigm. The course will explore language syntax, semantics, names/scopes, types, expressions, assignment, subprograms, abstraction and inheritance.  This exploration will have several forms. Students will study the programming language concepts at a theoretical level, use the concepts in functional language programming, and implement the concepts by designing language interpreters.",null,null
26,233,1,Introduction to Data Structures,"[4,5)","Different representations of data: lists, stacks and queues, trees, graphs, and files.  Manipulation of data: searching and sorting, hashing, recursion and higher order functions.  Abstract data types, templating, and the separation of interface and implementation.  Introduction to asymptotic analysis. The Java language is used to illustrate the concepts and as an implementation vehicle throughout the course.",null,null
27,396,1,Independent Projects,"[1,7)",Independent projects in Computer and Data Science.,null,null
28,341,1,Introduction to Database Systems,"[3,4)","Relational model, ER model, relational algebra and calculus, SQL, OBE, security, views, files and physical database structures, query processing and query optimization, normalization theory, concurrency control, object relational systems, multimedia databases, Oracle SQL server, Microsoft SQL server.",null,null
29,373,1,Modern Robot Programming,"[3,4)","The goal of this course is to learn modern methods for building up robot capabilities using the Robot Operating System (ROS). Through a sequence of assignments, students learn how to write software to control both simulated and physical robots. Material includes: interfacing software to robot I/O; path and trajectory planning for robot arms; object identification and localization from 3-D sensing; manipulation planning; and development of graphical interfaces for supervisory robot control. Laboratory assignments are scheduled in small groups to explore implementations on specific robots.  Graduate students will also perform an independent project.",null,null
30,497,1,Artificial Intelligence: Statistical Natural Language Processing,"[3,4)","This course gives students an overview of the stat of the art in natural language processing. We will discuss computational aspects of language modeling  through probabilistic models, computational approaches to syntax (parsing) and semantic representations, discourse and dialog. We will study the applications of these techniques to a variety of problems including information extraction, translation and summarization. At the end of the course a student should be able to (i) understand the various statistical models and algorithms for NLP (ii) modify them as needed or design novel approaches for specific NLP tasks and (iii) understand how to evaluate the performance of these models and compare them to alternatives.",null,null
31,390,1,Advanced Game Development Project,"[3,4)","This game development project course will bring together an inter-professional group of students in the fields of engineering, computer science, and art to focus on the design and development of a complete, fully functioning computer game as an interdisciplinary team. The student teams are given complete liberty to design their own fully functional games from their original concept to a playable game published in an online marketplace. Student teams will experience the entire game development cycle as they execute their projects. Responsibilities include creating a game idea, writing a story, developing the artwork, designing characters, implementing music and sound effects, programming and testing the game, and publishing the final project. Students enrolled in 487 will develop a healthcare or education virtual environment or video game in collaboration with a mentor who has expertise in the chosen area.",null,null
32,476,1,Mobile Robotics,"[3,4)","Design of software systems for mobile robot control, including: motion control; sensory processing; localization and mapping; mobile-robot planning and navigation; and implementation of goal-directed behaviors.  The course has a heavy lab component involving a sequence of design challenges and competitions performed in teams.",null,null
33,293,1,Software Craftsmanship,"[4,5)","A course to improve programming skills, software quality, and the software development process.  Software design; Version control; Control issues and routines;  Pseudo-code programming process and developer testing; Defensive programming; Classes; Debugging; Self-documenting code; Refactoring.",'junior & senior',null
34,490,1,Digital Image Processing,"[3,4)","Digital images are introduced as two-dimensional sampled arrays of data.  The course begins with one-to-one operations such as image addition and subtraction and image descriptors such as the histogram.  Basic filters such as the gradient and Laplacian in the spatial domain are used to enhance images.  The 2-D Fourier transform is introduced and frequency domain operations such as high and low-pass filtering are developed.  It is shown how filtering techniques can be used to remove noise and other image degradation.  The different methods of representing color images are described and fundamental concepts of color image transformations and color image processing are developed.  One or more advanced topics such as wavelets, image compression, and pattern recognition will be covered as time permits.  Programming assignments using software such as MATLAB will illustrate the application and implementation of digital image processing.",null,null
35,405,1,Data Structures and File Management,"[3,4)","Fundamental concepts: sequential allocation, linked allocation, lists, trees, graphs, internal sorting, external sorting, sequential, binary, interpolation search, hashing file, indexed files, multiple level index structures, btrees, hashed files. Multiple attribute retrieval; inverted files, multi lists, multiple-key hashing, hd trees. Introduction to data bases. Data models.",null,null
36,425,1,Computer Networks I,"[3,4)","An introduction to computer networks and the Internet. Applications: http, ftp, e-mail, DNS, socket programming. Transport: UDP, TCP, reliable data transfer, and congestion control. Network layer: IP, routing and NAT. Link layer: taxonomy, Ethernet, 802.11.",null,null
37,377,1,Introduction to Connected Devices,"[3,4)","Introduction to Connected Devices (e.g., Internet of Things).  Undergraduates work in pairs to build a complete connected-device system, an embedded device with wireless networking, cloud and web, and mobile, and then develop hands-on experience with systems-level aspects of the connected-device system, including analytics, remote firmware update, load testing, and essential security.  Students learn about current architectures, languages, and technologies, such as Pub/Sub (MQTT), Python, Objective-C, Python Django, JavaScript, HTML/CSS, and Bluetooth Low Energy.",null,null
38,600,1,Special Topics,"[1,19)",null,null,null
39,600,1,Graduate Teaching III,"[0,1)","This course will provide Ph.D. candidate with experience in teaching undergraduate or graduate students.  The experience is expected to involve direct student contact but will be based upon the specific departmental needs and teaching obligations.  This teaching experience will be conducted under the supervision of the faculty member who is responsible for the course, but the academic advisor will assess the educational plan to ensure that it provides an educational experience for the student.  Students in this course may be expected to perform one or more of the following teaching related activities running recitation sessions, providing laboratory assistance, developing teaching or lecture materials presenting lectures.",null,'Ph.D.'
40,392,1,App Development for iOS,"[3,4)","This course is an introduction to app development for iPhone and iPad using Cocoa Touch Framework and Xcode development environment. Topics include Swift programming language and iOS SDK/foundations, object-oriented design and model-view-controller framework, user interface design using Xcode. Additional topics may include data management, map applications, animations and some recent developments in iOS.",null,null
41,651,1,Thesis M.S.,"[1, 19)",Credit as arranged,null,null
42,486,1,"Quantum Computing, Information, and Devices","[3,4)","An introduction to the math, physics, engineering, and computer science underlying the rapidly emerging fields of quantum computing, quantum information, and quantum devices. The course is taught by a group of faculty from physics, engineering, computer science, and math, and is geared towards students with diverse backgrounds and interests in these fields.  Students will select a concentration in one of these four areas, and the coursework, while still covering all topics, will be adjusted to focus on the selected area in the most detail.  Note that the listed prerequisites depend on choice of concentration. 

Topics will include:
1.	(Mathematics) Introduction to linear algebra, convex geometry, fundamental theory of quantum information.
2.	(Physics) Introduction to the quantum mechanics of two-level systems (qubits). Survey of physics and materials for qubit technologies.
3.	(Computer Science) Basic quantum gates and circuits, introduction to the theory of algorithms, survey of quantum algorithms.
4.	(Engineering) Quantum architectures, mapping algorithms onto circuits.

The course consists of lectures, homework, and group projects.  Group projects will aim to synthesize the diverse backgrounds of the students and instructors to capture the interdisciplinary nature of the field. Students taking the course for graduate credit will complete an additional literature research project and presentation, in addition to enhanced problem sets.",null,null
43,621,1,Special Projects,"[1, 19)",null,null,null
44,310,1,Algorithms,"[3,4)","Fundamentals in algorithm design and analysis. Loop invariants, asymptotic notation, recurrence relations, sorting algorithms, divide-and-conquer, dynamic programming, greedy algorithms, basic graph algorithms.",null,null
45,305,1,"Files, Indexes and Access Structures for Big Data","[3,4)","Database management become a central component of a modern computing environment, and, as a result, knowledge about database systems has become an essential part of education in computer science and data science. This course is an introduction to the nature and purpose of database systems, fundamental concepts for designing, implementing and querying a database and database architectures.
Objectives:
-An expert knowledge of basic data structures, basic searching, sorting, methods,
algorithm techniques, (such as greedy and divide and conquer)
-In-depth knowledge on Search and Index Structures for large, heterogeneous data
including multidimensional data, high dimensional data and data in metric spaces
(e.g., sequences, images), on different search methods (e.g. similarity searching,
partial match, exact match), and on dimensionality reduction techniques.",null,null
46,439,1,Web Data Mining,"[3,4)","Web crawling technology, web search and information extraction, unsupervised and semi-supervised learning techniques and their application to web data extraction, social network analysis, various pagerank algorithms, link analysis, web resource discovery, web, resource description framework (RDF), XML, Web Ontology Language (OWL).",null,null
47,410,1,Analysis of Algorithms,"[3,4)","This course covers fundamental topics in algorithm design and analysis in depth. Amortized analysis, NP-completeness and reductions, dynamic programming, advanced graph algorithms, string algorithms, geometric algorithms, local search heuristics.",null,null
48,499,1,Algorithmic Robotics,"[3,4)","This course introduces basic algorithmic techniques in robotic perception and planning.  Course is divided into two parts.  The first part introduces probabilistic modeling of robotic motion and sensing, Gaussian and nonparametric filters, and algorithms for mobile robot localization.  The second part introduces fundamental deterministic and randomized algorithms for motion planning.",'junior & senior',null
